{
  "schema_version": "rf.semantic-spine-graph.v1",
  "spec_digest": "3011af117df566875e121b2e6115bab6c7f8b8adc7654f31a3bf59396ffda223",
  "spec_files": [
    "spec/B.BLAME_CRITICISM.md",
    "spec/B.PRESSURE_FOR_CHANGE.md",
    "spec/B.REPAIR_ATTEMPT.md",
    "spec/B.VALIDATION.md",
    "spec/_ontology-versions.md"
  ],
  "entities": [
    {
      "id": "example:blame-criticism-amb-ru-01",
      "kind": "example",
      "source": {
        "file": "spec/B.BLAME_CRITICISM.md",
        "line_start": 75,
        "line_end": 82
      },
      "attributes": {
        "id": "blame-criticism-amb-ru-01",
        "language": "ru",
        "text": "Опять ты со своими шуточками…",
        "unit": "utterance",
        "verdict": "ambiguous",
        "rationale": "может быть и упрёком, и игрой — решает контекст и просодические маркеры (эмодзи, история пары)"
      }
    },
    {
      "id": "example:blame-criticism-neg-en-01",
      "kind": "example",
      "source": {
        "file": "spec/B.BLAME_CRITICISM.md",
        "line_start": 66,
        "line_end": 73
      },
      "attributes": {
        "id": "blame-criticism-neg-en-01",
        "language": "en",
        "text": "I hate that we missed the bus today.",
        "unit": "utterance",
        "verdict": "negative",
        "rationale": "frustration about an event, not an attribution of blame to the partner"
      }
    },
    {
      "id": "example:blame-criticism-neg-ru-01",
      "kind": "example",
      "source": {
        "file": "spec/B.BLAME_CRITICISM.md",
        "line_start": 48,
        "line_end": 55
      },
      "attributes": {
        "id": "blame-criticism-neg-ru-01",
        "language": "ru",
        "text": "ну ты дебил 😂❤️",
        "unit": "utterance",
        "verdict": "negative",
        "rationale": "формально оскорбление, но маркеры юмора и привязанности; в паре с историей playful insults это не критика — канонический confusable-случай"
      }
    },
    {
      "id": "example:blame-criticism-pos-en-01",
      "kind": "example",
      "source": {
        "file": "spec/B.BLAME_CRITICISM.md",
        "line_start": 57,
        "line_end": 64
      },
      "attributes": {
        "id": "blame-criticism-pos-en-01",
        "language": "en",
        "text": "You never listen to me.",
        "unit": "utterance",
        "verdict": "positive",
        "rationale": "generalizing quantifier targeting the partner"
      }
    },
    {
      "id": "example:blame-criticism-pos-ru-01",
      "kind": "example",
      "source": {
        "file": "spec/B.BLAME_CRITICISM.md",
        "line_start": 39,
        "line_end": 46
      },
      "attributes": {
        "id": "blame-criticism-pos-ru-01",
        "language": "ru",
        "text": "Ты всегда обо всём забываешь.",
        "unit": "utterance",
        "verdict": "positive",
        "rationale": "генерализующий квантор + приписывание вины"
      }
    },
    {
      "id": "example:pressure-for-change-neg-en-01",
      "kind": "example",
      "source": {
        "file": "spec/B.PRESSURE_FOR_CHANGE.md",
        "line_start": 64,
        "line_end": 71
      },
      "attributes": {
        "id": "pressure-for-change-neg-en-01",
        "language": "en",
        "text": "Could you grab milk on the way home?",
        "unit": "utterance",
        "verdict": "negative",
        "rationale": "ordinary request, no pressure"
      }
    },
    {
      "id": "example:pressure-for-change-neg-ru-01",
      "kind": "example",
      "source": {
        "file": "spec/B.PRESSURE_FOR_CHANGE.md",
        "line_start": 46,
        "line_end": 53
      },
      "attributes": {
        "id": "pressure-for-change-neg-ru-01",
        "language": "ru",
        "text": "Можешь завтра забрать посылку?",
        "unit": "utterance",
        "verdict": "negative",
        "rationale": "нейтральная разовая просьба"
      }
    },
    {
      "id": "example:pressure-for-change-pos-en-01",
      "kind": "example",
      "source": {
        "file": "spec/B.PRESSURE_FOR_CHANGE.md",
        "line_start": 55,
        "line_end": 62
      },
      "attributes": {
        "id": "pressure-for-change-pos-en-01",
        "language": "en",
        "text": "I need you to actually start calling when you are late. Every time.",
        "unit": "utterance",
        "verdict": "positive",
        "rationale": "insistent demand for behavior change"
      }
    },
    {
      "id": "example:pressure-for-change-pos-ru-01",
      "kind": "example",
      "source": {
        "file": "spec/B.PRESSURE_FOR_CHANGE.md",
        "line_start": 37,
        "line_end": 44
      },
      "attributes": {
        "id": "pressure-for-change-pos-ru-01",
        "language": "ru",
        "text": "Сколько можно повторять — убери за собой, я серьёзно.",
        "unit": "utterance",
        "verdict": "positive",
        "rationale": "повторное требование с нажимом"
      }
    },
    {
      "id": "example:repair-attempt-neg-en-01",
      "kind": "example",
      "source": {
        "file": "spec/B.REPAIR_ATTEMPT.md",
        "line_start": 64,
        "line_end": 71
      },
      "attributes": {
        "id": "repair-attempt-neg-en-01",
        "language": "en",
        "text": "Fine. Whatever you say.",
        "unit": "utterance",
        "verdict": "negative",
        "rationale": "capitulation/withdrawal marker, not repair"
      }
    },
    {
      "id": "example:repair-attempt-neg-ru-01",
      "kind": "example",
      "source": {
        "file": "spec/B.REPAIR_ATTEMPT.md",
        "line_start": 46,
        "line_end": 53
      },
      "attributes": {
        "id": "repair-attempt-neg-ru-01",
        "language": "ru",
        "text": "Извини конечно, но это ты всё начала.",
        "unit": "utterance",
        "verdict": "negative",
        "rationale": "форма извинения, содержание — контратака"
      }
    },
    {
      "id": "example:repair-attempt-pos-en-01",
      "kind": "example",
      "source": {
        "file": "spec/B.REPAIR_ATTEMPT.md",
        "line_start": 55,
        "line_end": 62
      },
      "attributes": {
        "id": "repair-attempt-pos-en-01",
        "language": "en",
        "text": "I'm sorry, that came out wrong — let me try again.",
        "unit": "utterance",
        "verdict": "positive",
        "rationale": "apology + restart offer"
      }
    },
    {
      "id": "example:repair-attempt-pos-ru-01",
      "kind": "example",
      "source": {
        "file": "spec/B.REPAIR_ATTEMPT.md",
        "line_start": 37,
        "line_end": 44
      },
      "attributes": {
        "id": "repair-attempt-pos-ru-01",
        "language": "ru",
        "text": "Прости, я правда затупил. Давай сначала?",
        "unit": "utterance",
        "verdict": "positive",
        "rationale": "извинение + предложение перезапуска"
      }
    },
    {
      "id": "example:validation-neg-en-01",
      "kind": "example",
      "source": {
        "file": "spec/B.VALIDATION.md",
        "line_start": 65,
        "line_end": 72
      },
      "attributes": {
        "id": "validation-neg-en-01",
        "language": "en",
        "text": "Ok noted.",
        "unit": "utterance",
        "verdict": "negative",
        "rationale": "acknowledgement of information, not of experience"
      }
    },
    {
      "id": "example:validation-neg-ru-01",
      "kind": "example",
      "source": {
        "file": "spec/B.VALIDATION.md",
        "line_start": 47,
        "line_end": 54
      },
      "attributes": {
        "id": "validation-neg-ru-01",
        "language": "ru",
        "text": "Понятно.",
        "unit": "utterance",
        "verdict": "negative",
        "rationale": "формальный маркер без признания переживания"
      }
    },
    {
      "id": "example:validation-pos-en-01",
      "kind": "example",
      "source": {
        "file": "spec/B.VALIDATION.md",
        "line_start": 56,
        "line_end": 63
      },
      "attributes": {
        "id": "validation-pos-en-01",
        "language": "en",
        "text": "I get why that hurt — it makes sense you were upset.",
        "unit": "utterance",
        "verdict": "positive",
        "rationale": "explicit acknowledgement of the partner's emotion"
      }
    },
    {
      "id": "example:validation-pos-ru-01",
      "kind": "example",
      "source": {
        "file": "spec/B.VALIDATION.md",
        "line_start": 38,
        "line_end": 45
      },
      "attributes": {
        "id": "validation-pos-ru-01",
        "language": "ru",
        "text": "Понимаю, звучит обидно, я бы тоже разозлилась.",
        "unit": "utterance",
        "verdict": "positive",
        "rationale": "признание эмоции + нормализация"
      }
    },
    {
      "id": "generated:experiments/semantic-spine/generated/ontology.json",
      "kind": "generated",
      "source": {
        "file": "spine/compiler.py",
        "line_start": 0,
        "line_end": 0
      },
      "attributes": {
        "spec_digest": "3011af117df566875e121b2e6115bab6c7f8b8adc7654f31a3bf59396ffda223"
      }
    },
    {
      "id": "label:B.BLAME_CRITICISM",
      "kind": "label",
      "source": {
        "file": "spec/B.BLAME_CRITICISM.md",
        "line_start": 3,
        "line_end": 19
      },
      "attributes": {
        "id": "B.BLAME_CRITICISM",
        "canonical_name": "Blame / criticism",
        "plain_language_name_en": "Blaming or criticizing the partner",
        "plain_language_name_ru": "Обвинение или критика партнёра",
        "operational_definition": "Высказывание приписывает партнёру вину или негативно характеризует его личность/паттерн поведения в целом (генерализация), а не описывает конкретный эпизод и его эффект. Маркеры: генерализующие кванторы (всегда/никогда), оценка личности вместо поведения, сарказм с враждебной окраской.",
        "allowed_units": [
          "utterance",
          "turn"
        ],
        "directionality": "other_directed",
        "inclusion_criteria": [